
--- Job new2.gms Start 12/30/25 17:22:53 51.3.0 38407a9b WEX-WEI x86 64bit/MS Windows
--- Applying:
    C:\GAMS\51\gmsprmNT.txt
--- GAMS Parameters defined
    Input C:\Users\brhmh\Desktop\new2.gms
    PageSize 0
    ScrDir C:\Users\brhmh\Desktop\225a\
    SysDir C:\GAMS\51\
    LogOption 3
    AppendLog 1
    ErrMsg 1
    ErrorLog 99
    IDE 1
    LstTitleLeftAligned 1
Licensee: ibrahim hakk? kele?                            G251126+0003Ac-GEN
          22050351013@aybu.edu.tr                                 CLA114785
          225a\gamslice.dat
          node:23457503 mem:16 cores:6 ipport:64305 v:2                    
          Community license for demonstration and instructional purposes only
System information: 6 physical cores and 16 Gb physical memory detected
GAMS 51.3.0   Copyright (C) 1987-2025 GAMS Development. All rights reserved
--- Starting compilation
--- new2.gms(217) 3 Mb
--- Starting execution: elapsed 0:00:00.014
--- new2.gms(209) 4 Mb
--- Generating MIP model MakaleSenaryo1
--- new2.gms(211) 4 Mb
---   1,297 rows  1,009 columns  3,318 non-zeroes
---   400 discrete-columns
--- Range statistics (absolute non-zero finite values)
--- RHS       [min, max] : [ 1.000E+00, 3.800E+05] - Zero values observed as well
--- Bound     [min, max] : [ 1.000E+00, 1.000E+00] - Zero values observed as well
--- Matrix    [min, max] : [ 3.500E-04, 6.600E+04]
--- Executing CPLEX (Solvelink=2): elapsed 0:00:00.021

IBM ILOG CPLEX   51.3.0 38407a9b Oct 27, 2025          WEI x86 64bit/MS Window

*** This solver runs with a community license. No commercial use.
--- GMO setup time: 0.00s
--- Space for names approximately 0.05 Mb
--- Use option 'names no' to turn use of names off
--- GMO memory 0.76 Mb (peak 0.77 Mb)
--- Dictionary memory 0.00 Mb
--- Cplex 22.1.2.0 link memory 0.03 Mb (peak 0.14 Mb)
--- Starting Cplex

Version identifier: 22.1.2.0 | 2024-11-25 | 0edbb82fd
CPXPARAM_Advance                                 0
CPXPARAM_MIP_Display                             4
CPXPARAM_MIP_Pool_Capacity                       0
CPXPARAM_MIP_Tolerances_AbsMIPGap                0
CPXPARAM_MIP_Tolerances_MIPGap                   0
Generic callback                                 0x50
Tried aggregator 2 times.
MIP Presolve eliminated 655 rows and 103 columns.
MIP Presolve added 90 rows and 0 columns.
MIP Presolve modified 143 coefficients.
Aggregator did 91 substitutions.
Reduced MIP has 640 rows, 815 columns, and 2112 nonzeros.
Reduced MIP has 319 binaries, 0 generals, 0 SOSs, and 0 indicators.
Presolve time = 0.00 sec. (2.52 ticks)
Found incumbent of value 500614.016000 after 0.00 sec. (4.14 ticks)
Probing fixed 0 vars, tightened 1 bounds.
Probing time = 0.00 sec. (0.30 ticks)
Tried aggregator 1 time.
MIP Presolve eliminated 145 rows and 160 columns.
Reduced MIP has 495 rows, 655 columns, and 1752 nonzeros.
Reduced MIP has 304 binaries, 0 generals, 0 SOSs, and 0 indicators.
Presolve time = 0.00 sec. (1.07 ticks)
Probing time = 0.00 sec. (0.27 ticks)
Tried aggregator 1 time.
Detecting symmetries...
Reduced MIP has 495 rows, 655 columns, and 1752 nonzeros.
Reduced MIP has 304 binaries, 0 generals, 0 SOSs, and 0 indicators.
Presolve time = 0.00 sec. (1.50 ticks)
Probing time = 0.00 sec. (0.27 ticks)
Clique table members: 320.
MIP emphasis: balance optimality and feasibility.
MIP search method: dynamic search.
Parallel mode: deterministic, using up to 12 threads.
Tried aggregator 1 time.
LP Presolve eliminated 144 rows and 208 columns.
Aggregator did 256 substitutions.
Reduced LP has 95 rows, 191 columns, and 360 nonzeros.
Presolve time = 0.00 sec. (0.47 ticks)

Iteration log . . .
Iteration:     1   Dual objective     =        -14526.593000
Iteration:    62   Dual objective     =        209029.974697
Iteration:   124   Dual objective     =        377035.934207
Initializing dual steep norms . . .
Root relaxation solution time = 0.00 sec. (1.24 ticks)

        Nodes                                         Cuts/
   Node  Left     Objective  IInf  Best Integer    Best Bound    ItCnt     Gap

*     0+    0                       465375.3370   -14533.4380           103.12%
Found incumbent of value 465375.337000 after 0.05 sec. (20.46 ticks)
      0     0   454589.0379   101   465375.3370   454589.0379      166    2.32%
      0     0   454663.5213   125   465375.3370     Cuts: 223      399    2.30%
      0     0   454758.1023   105   465375.3370     Cuts: 223      587    2.28%
      0     0   454804.6545   113   465375.3370     Cuts: 211      737    2.27%
      0     0   454830.9179   100   465375.3370     Cuts: 124      845    2.27%
*     0+    0                       455590.3280   454830.9179             0.17%
Found incumbent of value 455590.328000 after 0.22 sec. (102.64 ticks)
      0     0   454854.5149   126   455590.3280     Cuts: 131      961    0.16%
      0     0   454898.7308   106   455590.3280     Cuts: 113     1149    0.15%
      0     0   455014.9180    76   455590.3280     Cuts: 112     1337    0.13%
      0     0   455035.3172    94   455590.3280     Cuts: 105     1450    0.12%
      0     0   455121.0653   123   455590.3280      Cuts: 88     1656    0.10%
      0     0   455372.6718   140   455590.3280     Cuts: 169     2078    0.05%
      0     0   455399.7514   139   455590.3280     Cuts: 223     2336    0.04%
      0     2   455399.7514    95   455590.3280   455399.7514     2336    0.04%
Elapsed time = 0.52 sec. (272.43 ticks, tree = 0.02 MB)
*   159    70      integral     0   455584.0620   455403.1408     7027    0.04%
                                                     Cuts: 23                  
Found incumbent of value 455584.062000 after 0.62 sec. (317.66 ticks)
*   173+   86                       455572.8030   455403.1408             0.04%
                                                  Impl Bds: 1                  
Found incumbent of value 455572.803000 after 0.62 sec. (319.64 ticks)
*   322   135      integral     0   455571.3210   455408.0467    13959    0.04%
                                                     Cuts: 30                  
Found incumbent of value 455571.321000 after 0.67 sec. (346.06 ticks)
*   521+  213                       455569.5010   455410.8219             0.03%
                                                     Cuts: 37                  
Found incumbent of value 455569.501000 after 0.72 sec. (373.39 ticks)
*   745   308      integral     0   455549.3620   455422.5476    35104    0.03%
                                                     Cuts: 46                  
Found incumbent of value 455549.362000 after 0.81 sec. (416.37 ticks)
   1214   386   455527.7458    36   455549.3620   455440.2964    62471    0.02%
                                                     Cuts: 61                  
   2479   426        cutoff         455549.3620   455478.2207   132751    0.02%
                                                    Cuts: 125                  

GUB cover cuts applied:  1
Clique cuts applied:  32
Cover cuts applied:  184
Implied bound cuts applied:  67
Flow cuts applied:  162
Mixed integer rounding cuts applied:  122
Flow path cuts applied:  6
Zero-half cuts applied:  3
Multi commodity flow cuts applied:  6
Lift and project cuts applied:  10
Gomory fractional cuts applied:  29

Root node processing (before b&c):
  Real time             =    0.50 sec. (272.00 ticks)
Parallel b&c, 12 threads:
  Real time             =    1.19 sec. (607.39 ticks)
  Sync time (average)   =    0.26 sec.
  Wait time (average)   =    0.00 sec.
                          ------------
Total (root+branch&cut) =    1.69 sec. (879.39 ticks)

--- MIP status (101): integer optimal solution.
--- Cplex Time: 1.69sec (det. 879.39 ticks)

--- Returning a primal only solution to GAMS (marginals all set to NA).
--- Fixing integer variables and solving final LP...

Version identifier: 22.1.2.0 | 2024-11-25 | 0edbb82fd
CPXPARAM_Advance                                 2
CPXPARAM_MIP_Display                             4
CPXPARAM_MIP_Pool_Capacity                       0
CPXPARAM_MIP_Tolerances_AbsMIPGap                0
CPXPARAM_MIP_Tolerances_MIPGap                   0
Tried aggregator 1 time.
LP Presolve eliminated 1134 rows and 809 columns.
Aggregator did 130 substitutions.
Reduced LP has 32 rows, 70 columns, and 128 nonzeros.
Presolve time = 0.00 sec. (0.67 ticks)
Initializing dual steep norms . . .

Iteration log . . .
Iteration:     1   Dual objective     =        138272.053000

--- Fixed MIP status (1): optimal.
--- Cplex Time: 0.00sec (det. 1.21 ticks)


Proven optimal solution
MIP Solution:       455549.362000    (176358 iterations, 3577 nodes)
Final Solve:        455549.362000    (27 iterations)

Best possible:      455549.362000
Absolute gap:            0.000000
Relative gap:            0.000000

--- Reading solution for model MakaleSenaryo1
--- Executing after solve: elapsed 0:00:01.766
--- new2.gms(217) 4 Mb
*** Status: Normal completion
--- Job new2.gms Stop 12/30/25 17:22:55 elapsed 0:00:01.766
